"Identificador;Nome;Ano de lancamento;Plataforma;Descricao;Disponibilidade"
"1;The Legend of Zelda: Breath of the Wild;2017;Nintendo Switch;Acao-aventura em um mundo aberto;true"
"2;God of War;2018;PlayStation 4;Acao-aventura baseado na mitologia nordica;true"
"3;Red Dead Redemption 2;2018;PlayStation 4, Xbox One, PC;Aventura de faroeste em mundo aberto;true"
"4;The Witcher 3: Wild Hunt;2015;PlayStation 4, Xbox One, PC;RPG de mundo aberto baseado em uma serie de livros;true"
"5;Super Mario Odyssey;2017;Nintendo Switch;Plataforma 3D com o iconico personagem Mario;true"
"6;Cyberpunk 2077;2020;PlayStation 4, Xbox One, PC;RPG de acao em um futuro distopico;true"
"7;Hades;2020;Nintendo Switch, PC;Roguelike baseado na mitologia grega;true"
"8;Horizon Zero Dawn;2017;PlayStation 4, PC;Aventura em mundo aberto com dinossauros mecanicos;true"
"9;Spider-Man;2018;PlayStation 4;Acao-aventura com o iconico super-heroi da Marvel;true"
"10;Persona 5;2016;PlayStation 4;JRPG com elementos de simulacao social;true"
"11;Celeste;2018;Nintendo Switch, PlayStation 4, Xbox One, PC;Jogo de plataforma focado em desafios de precisao;true"
"12;Ghost of Tsushima;2020;PlayStation 4;Aventura em mundo aberto no Japao feudal;true"
"13;DOOM Eternal;2020;PlayStation 4, Xbox One, PC;FPS frenetico contra demonios;true"
"14;Among Us;2018;PC, Mobile;Jogo de deducao social multijogador;true"
"15;Animal Crossing: New Horizons;2020;Nintendo Switch;Simulacao de vida em uma ilha deserta;true"
"16;Stardew Valley;2016;PlayStation 4, Xbox One, Nintendo Switch, PC;Simulacao de fazenda e vida rural;true"
"17;Minecraft;2011;PlayStation 4, Xbox One, Nintendo Switch, PC;Jogo de construcao e exploracao em um mundo pixelado;true"
"18;Fortnite;2017;PlayStation 4, Xbox One, Nintendo Switch, PC;Battle royale com construcao e tiro;true"
"19;Apex Legends;2019;PlayStation 4, Xbox One, PC;Battle royale com personagens unicos;true"
"20;League of Legends;2009;PC;MOBA com um elenco diversificado de campeoes;true"
"21;Overwatch;2016;PlayStation 4, Xbox One, PC;FPS baseado em equipes com herois unicos;true"
"22;Valorant;2020;PC;FPS tatico com habilidades especiais;true"
"23;The Elder Scrolls V: Skyrim;2011;PlayStation 4, Xbox One, PC;RPG de mundo aberto em um universo de fantasia;true"
"24;Grand Theft Auto V;2013;PlayStation 4, Xbox One, PC;Acao-aventura em mundo aberto com multiplos protagonistas;true"
"25;Dark Souls III;2016;PlayStation 4, Xbox One, PC;RPG de acao conhecido por sua dificuldade elevada;true"
"26;Sekiro: Shadows Die Twice;2019;PlayStation 4, Xbox One, PC;Acao-aventura com combates desafiadores;true"
"27;Bloodborne;2015;PlayStation 4;Acao-aventura gotica com mecanicas de combate rapidas;true"
"28;Resident Evil 2;2019;PlayStation 4, Xbox One, PC;Remake do classico jogo de horror de sobrevivencia;true"
"29;Monster Hunter: World;2018;PlayStation 4, Xbox One, PC;Acao-RPG de caca a monstros gigantes;true"
"30;The Last of Us Part II;2020;PlayStation 4;Acao-aventura com narrativa profunda e emocionante;true"
"31;Journey;2012;PlayStation 4, PC;Jogo de exploracao e descoberta com graficos artisticos;true"
"32;Final Fantasy VII Remake;2020;PlayStation 4;Reimaginacao do classico JRPG com graficos modernos;true"
"33;Nier: Automata;2017;PlayStation 4, Xbox One, PC;Acao-RPG com uma historia intrigante e multiplos finais;true"
"34;Fire Emblem: Three Houses;2019;Nintendo Switch;RPG tatico com elementos de simulacao;true"
"35;Cuphead;2017;Nintendo Switch, PlayStation 4, Xbox One, PC;Jogo de plataforma com graficos inspirados em desenhos animados antigos;true"
"36;Ori and the Will of the Wisps;2020;Nintendo Switch, Xbox One, PC;Jogo de plataforma com belos graficos e trilha sonora;true"
"37;Hollow Knight;2017;Nintendo Switch, PlayStation 4, Xbox One, PC;Metroidvania com exploracao profunda e combate desafiador;true"
"38;Celeste;2018;Nintendo Switch, PlayStation 4, Xbox One, PC;Plataforma com uma historia emocional sobre superacao;true"
"39;Dead Cells;2018;Nintendo Switch, PlayStation 4, Xbox One, PC;Roguelike com elementos de metroidvania e combates intensos;true"
"40;Splatoon 2;2017;Nintendo Switch;Jogo de tiro em terceira pessoa com batalhas de tinta;true"
"41;The Outer Worlds;2019;PlayStation 4, Xbox One, PC;RPG de acao em um universo de ficcao cientifica;true"
"42;Assassin's Creed Valhalla;2020;PlayStation 4, Xbox One, PC;Acao-aventura em mundo aberto com tematica viking;true"
"43;Control;2019;PlayStation 4, Xbox One, PC;Acao-aventura sobrenatural em um ambiente de ficcao cientifica;true"
"44;Divinity: Original Sin II;2017;PlayStation 4, Xbox One, PC;RPG tatico com narrativa ramificada e combate por turnos;true"
"45;Disco Elysium;2019;PlayStation 4, Xbox One, PC;RPG com forte foco em narrativa e escolhas do jogador;true"
"46;Slay the Spire;2019;Nintendo Switch, PlayStation 4, Xbox One, PC;Deck-building roguelike com combates de cartas;true"
"47;Tetris Effect;2018;PlayStation 4, PC;Versao imersiva do classico jogo de quebra-cabeca;true"
"48;Hades;2020;Nintendo Switch, PC;Roguelike de acao com tematica mitologica;true"
"49;Celeste;2018;Nintendo Switch, PlayStation 4, Xbox One, PC;Plataforma com desafios de precisao e narrativa tocante;true"
"50;Return of the Obra Dinn;2018;Nintendo Switch, PlayStation 4, Xbox One, PC;Jogo de investigacao em preto e branco;true"
"51;Hitman 3;2021;PlayStation 4, Xbox One, PC;Stealth e assassinato em diversos cenarios globais;true"
"52;Mortal Kombat 11;2019;PlayStation 4, Xbox One, PC;Jogo de luta com combates intensos e personagens iconicos;true"
"53;Street Fighter V;2016;PlayStation 4, PC;Jogo de luta com uma grande variedade de personagens e estilos de combate;true"
"54;Tekken 7;2017;PlayStation 4, Xbox One, PC;Jogo de luta com uma longa historia e mecanicas de combate refinadas;true"
"55;Soulcalibur VI;2018;PlayStation 4, Xbox One, PC;Jogo de luta focado em combates com armas;true"
"56;Dragon Ball FighterZ;2018;PlayStation 4, Xbox One, PC;Jogo de luta baseado na popular serie de anime;true"
"57;Guilty Gear Strive;2021;PlayStation 4, PlayStation 5, PC;Jogo de luta com graficos estilizados e combates rapidos;true"
"58;BlazBlue: Cross Tag Battle;2018;PlayStation 4, Nintendo Switch, PC;Jogo de luta com personagens de diversas franquias;true"
"59;Granblue Fantasy: Versus;2020;PlayStation 4, PC;Jogo de luta baseado no popular RPG mobile;true"
"60;Injustice 2;2017;PlayStation 4, Xbox One, PC;Jogo de luta com personagens do universo DC Comics;true"
"61;Skullgirls;2012;PlayStation 4, Xbox One, PC;Jogo de luta com estilo artistico unico e personagens variados;true"
"62;Dead or Alive 6;2019;PlayStation 4, Xbox One, PC;Jogo de luta com combates rapidos e intensos;true"
"63;Marvel vs. Capcom: Infinite;2017;PlayStation 4, Xbox One, PC;Jogo de luta com personagens das franquias Marvel e Capcom;true"
"64;Power Rangers: Battle for the Grid;2019;PlayStation 4, Xbox One, Nintendo Switch, PC;Jogo de luta com personagens da serie Power Rangers;true"
"65;Samurai Shodown;2019;PlayStation 4, Xbox One, Nintendo Switch, PC;Jogo de luta focado em combates com armas de lamina;true"
"66;Rivals of Aether;2017;Nintendo Switch, PC;Jogo de luta indie com personagens baseados em elementos da natureza;true"
"67;Brawlhalla;2017;PlayStation 4, Xbox One, Nintendo Switch, PC;Jogo de luta gratuito com um elenco diversificado de personagens;true"
"68;Killer Instinct;2013;Xbox One, PC;Jogo de luta com combates rapidos e personagens iconicos;true"
"69;Dragon Ball Xenoverse 2;2016;PlayStation 4, Xbox One, Nintendo Switch, PC;Jogo de luta e RPG baseado na serie Dragon Ball;true"
"70;Naruto Shippuden: Ultimate Ninja Storm 4;2016;PlayStation 4, Xbox One, PC;Jogo de luta baseado na popular serie de anime;true"
"71;JoJo's Bizarre Adventure: All-Star Battle R;2013;PlayStation 4, PlayStation 5, PC;Jogo de luta baseado na serie de anime JoJo's Bizarre Adventure;true"
"72;My Hero One's Justice 2;2020;PlayStation 4, Xbox One, Nintendo Switch, PC;Jogo de luta baseado na serie de anime My Hero Academia;true"
"73;One Piece: Pirate Warriors 4;2020;PlayStation 4, Xbox One, Nintendo Switch, PC;Jogo de acao baseado na serie de anime One Piece;true"
"74;Fairy Tail;2020;PlayStation 4, Nintendo Switch, PC;RPG baseado na serie de anime Fairy Tail;true"
"75;Jump Force;2019;PlayStation 4, Xbox One, PC;Jogo de luta com personagens de varias series de anime;true"
"76;J-Stars Victory VS;2014;PlayStation 4, PlayStation 3, PlayStation Vita;Jogo de luta com personagens de diversas series de anime;true"
"77;Demon Slayer: Kimetsu no Yaiba - The Hinokami Chronicles;2021;PlayStation 4, PlayStation 5, Xbox One, PC;Jogo de luta baseado na serie de anime Demon Slayer;true"
"78;One Punch Man: A Hero Nobody Knows;2020;PlayStation 4, Xbox One, PC;Jogo de luta baseado na serie de anime One Punch Man;true"
"79;Guilty Gear Xrd -SIGN-;2014;PlayStation 4, PlayStation 3, PC;Jogo de luta com graficos estilizados e combates rapidos;true"
"80;BlazBlue: Central Fiction;2015;PlayStation 4, PlayStation 3, PC;Jogo de luta com uma historia complexa e personagens unicos;true"
"81;Under Night In-Birth Exe:Late[cl-r];2020;PlayStation 4, Nintendo Switch, PC;Jogo de luta com mecanicas de combate rapidas e precisas;true"
"82;Melty Blood: Type Lumina;2021;PlayStation 4, Nintendo Switch, PC;Jogo de luta baseado na serie visual novel Tsukihime;true"
"83;Granblue Fantasy: Versus;2020;PlayStation 4, PC;Jogo de luta baseado no popular RPG mobile;true"
"84;Dissidia Final Fantasy NT;2018;PlayStation 4, PC;Jogo de luta com personagens da serie Final Fantasy;true"
"85;Pokemon Tekken;2015;Nintendo Switch, Wii U;Jogo de luta com personagens da serie Pokemon;true"
"86;Arms;2017;Nintendo Switch;Jogo de luta com personagens usando bracos extensiveis;true"
"87;Nidhogg;2014;PlayStation 4, PC;Jogo de luta com combates de espadas em estilo retro;true"
"88;Divekick;2013;PlayStation 4, Xbox One, PC;Jogo de luta simplificado focado em saltos e chutes;true"
"89;Fantasy Strike;2019;Nintendo Switch, PlayStation 4, PC;Jogo de luta com controles simplificados e mecanicas profundas;true"
"90;Lethal League Blaze;2018;Nintendo Switch, PlayStation 4, Xbox One, PC;Jogo de luta com mecanicas baseadas em uma bola mortal;true"
"91;Power Rangers: Battle for the Grid;2019;Nintendo Switch, PlayStation 4, Xbox One, PC;Jogo de luta com personagens da serie Power Rangers;true"
"92;Omen of Sorrow;2018;PlayStation 4, PC;Jogo de luta com personagens inspirados em lendas e mitos;true"
"93;Fantasy Strike;2019;Nintendo Switch, PlayStation 4, PC;Jogo de luta com mecanicas simplificadas e profundidade estrategica;true"
"94;Shaq Fu: A Legend Reborn;2018;Nintendo Switch, PlayStation 4, Xbox One, PC;Jogo de luta estrelando o famoso jogador de basquete Shaquille O'Neal;true"
"95;Fight of Gods;2017;Nintendo Switch, PC;Jogo de luta com personagens de varias mitologias e religioes;true"
"96;Brawlhalla;2017;PlayStation 4, Xbox One;Jogo de luta gratuito com um elenco diversificado de personagens;true"
"97;Them's Fightin' Herds;2020;PlayStation 4, Xbox One, PC;Jogo de luta com personagens inspirados em animais;true"
"98;Primal Rage;1994;PlayStation 4, PC;Jogo de luta com criaturas pre-historicas e de fantasia;true"
"99;Virtua Fighter 5: Final Showdown;2012;PlayStation 4, Xbox One, PC;Jogo de luta 3D com combates tecnicos e precisos;true"
"100;Fighting EX Layer;2018;PlayStation 4, PC;Jogo de luta com personagens da serie Street Fighter EX;true"
"101;Teste de jogos;1990;PC;Testes de jogos funcional;false"
